ID,Title,Location,Salary,Summary
1015284880e2ff62,라인프렌즈 2022년 각 부문 수시,서울 용산구,,통신·모바일·게임>웹프로그래머> Python|인터넷·IT·통신·모바일·게임... 자바스크립트|인터넷·IT·통신·모바일·게임>빅데이터·AI(인공지능)> Python|마케팅·광고·홍보·조사>마케팅>마케팅기획|마케팅·광고·홍보·조사>마케...
e5b07966d95d324c,new[ HDC 랩스 ] [HDC랩스] 2022년 상반기 기술연구소 경력,성남 분당구,,빅데이터|인터넷·IT·통신·모바일·게임>응용프로그래머>JAVA|인터넷·IT·통신·모바일·게임>응용프로그래머> Python|인터넷·IT·통신·모바일·게임>응용프로그래머>클라우드|인터넷·IT·통신·모바일·게임>응용프로그래머>iOS...
835324335bc1c7da,[현대무벡스] 경력사원 상시,서울 종로구,,ABAP|인터넷·IT·통신·모바일·게임>응용프로그래머>클라우드|인터넷·IT·통신·모바일·게임>응용프로그래머> Python|인터넷·IT·통신·모바일·게임>빅데이터·AI(인공지능)>인공지능(AI)|인터넷·IT·통신·모바일·게임...
6dd48f3771d01215,"Student Researcher Intern, 2022",서울,,"programming languages, including: C/C++, Java, MATLAB, Go, Python, or similar. Ability to speak and write in English fluently..."
3bd4b3a778c2d8ad,new한국전자금융 상반기 각 부문,서울 마포구,,통신·모바일·게임>웹프로그래머> Python|인터넷·IT·통신·모바일·게임... 인공지능)> Python|인터넷·IT·통신·모바일·게임>응용프로그래머>인공지능(AI)|인터넷·IT·통신·모바일·게임>응용프로그래머> Python|인터넷...
a3db0fef10f726b8,new데이터 엔지니어 모집,서울 구로구,,REST API 개발 - 데이터 파이프라인 설계 및 개발 운영 자동화 자격요건 - Java 또는 Python 관련 경력 3년 이상 - Git / Bash Shell Script 사용 능력 보유 - 운영 서비스 자동화...
44e9ac7f0f94e784,한국필립모리스 2022년 상반기 수시,서울 영등포구,,통신·모바일·게임>웹프로그래머> Python|인터넷·IT·통신·모바일·게임... 용프로그래머>자바스크립트|인터넷·IT·통신·모바일·게임>응용프로그래머> Python|인터넷·IT·통신·모바일·게임>시스템프로그래머>펌웨어·어셈블러|인터...
8493efffb99ada2f,LG이노텍,경기도 파주,,"dispensing, Vision/Function test) 우대 - 제어 부문 : C+, C++, C#, Python 등 프로그래밍 언어 사용 능숙자 우대 - 외국어 역량 우수자 우대 (TS 150점 이상, OPIC IH..."
a27cd33cb789697d,[NHN] 인사운영,성남 판교역,,"분 - 꼼꼼하고 책임감 강한 분 - 일에 대한 열정이 있는 분 - 데이터 분석에 대한 지식이 있는 분 ( Python, R 등) 공통지원자격 - 병역필 혹은 면제로 해외여행에 결격 사유가 없는 자 지원방법 - 온라..."
42a2aede5f0d0880,각 부문별,서울 마포구,,통신·모바일·게임>빅데이터·AI(인공지능)>데이터분석|인터넷·IT·통신·모바일·게임>빅데이터·AI(인공지능)> Python|인터넷·IT·통신·모바일·게임>빅데이터·AI(인공지능)>머신러닝|인터넷·IT·통신·모바일·게임>빅데이터...
409e704f526c34c4,ML Engineer (토스뱅크),서울 강남구,,인터넷·IT·통신·모바일·게임>응용프로그래머>머신러닝(ML)|인터넷·IT·통신·모바일·게임>응용프로그래머> Python|인터넷·IT·통신·모바일·게임>통신·모바일>플랫폼(VM)|인터넷·IT·통신·모바일·게임>데이터베이스·DBA>SQL
3fd227ce442a7897,LG이노텍,서울 마곡역,,"머신러닝/딥러닝 알고리즘 개발 경험 * 머신러닝/딥러닝 프레임워크 스킬 ( Python, PyTorch 등) * SW 프로그래밍( Python, C, C++ 등) * DB 활용 스킬(SQL, NoSQL 등) * Agile..."
c5de9d2e35d053e0,AI 분석가,서울 영등포구,,"공학, 수학, 통계, 산업공학 등 우대사항 프로그래밍이 숙련 되신 분( Python 필수) 금융데이터 또는 시계열 데이터 기반 인공지능 모델 구축 및... 게임>빅데이터·AI(인공지능)> Python|인터넷·IT·통신·모바일·게임..."
78e99625e5de3c95,전문연구요원 (병역특례) 수시 (AI / HW 분야),성남 분당구,"연봉 40,000,000원 - 100,000,000원","모델의 RTL IP 설계 및 IP 검증 가능자 - Language: Python/Perl, C/C++ [우대 조건] - ARM based SoC 설계... Linux, shell, tcl, python, perl 사용 원활..."
d7fd149c8dee37a0,new한림대학교의료원 직원 공채,서울 영등포구,,통신·모바일·게임>빅데이터·AI(인공지능)>머신러닝|인터넷·IT·통신·모바일·게임>빅데이터·AI(인공지능)> Python|인터넷·IT·통신·모바일·게임>빅데이터·AI(인공지능)>데이터라벨링|인터넷·IT·통신·모바일·게임>ERP...
17c50785be44d4af,[NAVER Cloud] MLOps 서비스 개발,성남 분당구,,요역량]- 관련 경력 3년이상- Python 또는 Spring 환경에 대한... 웹프로그래머> Python|인터넷·IT·통신·모바일·게임>웹프로그래머>백엔드|인터넷·IT·통신·모바일·게임>응용프로그래머> Python|인터넷·IT·통신...
0776d9aa07c7c05d,[KSTEC] 통계 및 Business Analytics 신입 및 경력사원,성남 분당구,,"지능화 (의사결정 자동화) 시스템 개발 (SPSS, SAS, R, Python, Java 기반)2. 기업용 데이터과학 & 인공지능 플랫폼 솔루션3... 게임>빅데이터·AI(인공지능)> Python|인터넷·IT·통신·모바일·게임..."
cd21e80dbc65fdeb,웹프로그래머 (FrontEnd) 기업부설연구소 연구원 #python #js #FullStack #모바일,서울 용산구,"연봉 30,000,000원 - 60,000,000원","데이터 수집, 분석 및 가공 에 관련된 프로그램 개발 ( Python) REST API개발( Python)# 우대사항 javascript 개발경험 필수 python 개발 유경험자 우대 Android, iOS 개발 유경험자 우대..."
b5cdce28972b321e,LG전자,서울 서초구,,"통신 표준 기술 이해도 - 기술 검증 시뮬레이션 및 데이터 처리를 위한 프로그래밍 스킬 보유 (Matlab, Python, C/C++ 등) 양자내성암호/동형암호 특화 - 컴퓨터공학, 수학, 전자공학 관련 분야 박사학위 소유자..."
a3cadc7e043627cf,newAI 분야 경력직,서울 종로구,,공지능(AI)|인터넷·IT·통신·모바일·게임>빅데이터·AI(인공지능)> Python|인터넷·IT·통신·모바일·게임>응용프로그래머>머신러닝(ML)|인터넷... 그래머>C·C++|인터넷·IT·통신·모바일·게임>응용프로그래머> Python
1eae997b387cb491,2022년 미국 카네기멜론 대학교 AI 집중 교육프로그램 파견 교육생,서울,,게임>빅데이터·AI(인공지능)> Python|인터넷·IT·통신·모바일·게임... 시스템분석·설계>빅데이터|인터넷·IT·통신·모바일·게임>웹프로그래머> Python|인터넷·IT·통신·모바일·게임>소프트웨어·하드웨어>소프트웨어|인터넷...
2fee2c7a6bc4e321,new국가관세종합정보망운영연합회 상반기 신입(공채1기),서울 종로구,,통신·모바일·게임>빅데이터·AI(인공지능)>머신러닝|인터넷·IT·통신·모바일·게임>빅데이터·AI(인공지능)> Python|인터넷·IT·통신·모바일·게임>ERP·시스템분석·설계>빅데이터|인터넷·IT·통신·모바일·게임>ERP·시스...
66b192eca99fa208,new인공지능분야 개발연구원,서울 마포구,,통신·모바일·게임>빅데이터·AI(인공지능)>데이터분석|인터넷·IT·통신·모바일·게임>빅데이터·AI(인공지능)> Python|인터넷·IT·통신·모바일·게임>빅데이터·AI(인공지능)>머신러닝|인터넷·IT·통신·모바일·게임>빅데이터...
c2d17e5250562256,"[리얼클래스]백엔드 개발자 (Backend Developer, Python)",서울 강남구,,"[프로덕트그룹 소개]퀄슨 프로덕트 그룹은 퀄슨의 연구개발 조직으로, 유저의 학습경험 향상을 위한 제품개발과 운영효율 최적화를 위한 시스템을 만듭니다. 다양한 학습 컨텐츠를 더 나은 환경에서 제공하고, 진단을 통해 학습 효율성을..."
52519968a9441b4d,new한국대표부 민간파트너십팀 데이터 분석 담당 직원,서울 을지로동,,"데이터베이스 관리를 위한 프로그래밍 언어 1개 이상 가능자 (SQL, Python 등) 7. 유창한 한국어 및 영어 구사 능력을 가진 자 (작문... management (SQL, Python, etc.) 7..."
f56b4b9b5fa26dc9,new서울대학교 AI연구원 인턴,서울 관악구,,통신·모바일·게임>빅데이터·AI(인공지능)>데이터분석|인터넷·IT·통신·모바일·게임>빅데이터·AI(인공지능)> Python|인터넷·IT·통신·모바일·게임>빅데이터·AI(인공지능)>머신러닝|인터넷·IT·통신·모바일·게임>빅데이터...
444cf80dd61163ec,[HYBE] 데이터분석,서울 용산구,,있습니다. [주요 업무책임] 인터넷·IT·통신·모바일·게임>ERP·시스템분석·설계>빅데이터|인터넷·IT·통신·모바일·게임>ERP·시스템분석·설계>데이터분석|인터넷·IT·통신·모바일·게임>빅데이터·AI(인공지능)> Python
6d86e9f32d31c84f,LG CNS,서울,,"해가 뛰어난 자 - R, Python, SAS, SQL 등 활용 역량 우대사항(해당 내용 중 1개 이상) - ML/DL 경험 인력 우대 - 관련 분야 석사 이상 학위 소지자 우대 - R, Python등 데이터분석 모델링 경험..."
d5b3958637d1f0a6,2022년 4월 롯데멤버스 신입사원 일반전형,서울 중구,,통신·모바일·게임>빅데이터·AI(인공지능)>머신러닝|인터넷·IT·통신·모바일·게임>빅데이터·AI(인공지능)> Python|인터넷·IT·통신·모바일·게임>빅데이터·AI(인공지능)>R|인터넷·IT·통신·모바일·게임>ERP·시스템분...
fbed10c0a508a8b7,2022년 새일직업교육훈련 교육생,서울 용산구,,통신·모바일·게임>빅데이터·AI(인공지능)>데이터분석|인터넷·IT·통신·모바일·게임>빅데이터·AI(인공지능)> Python|인터넷·IT·통신·모바일·게임>빅데이터·AI(인공지능)>머신러닝|인터넷·IT·통신·모바일·게임>빅데이터...
a5680079cf9c5a5c,new[플레이채팅 유닛(CIC)] 서버 개발자 영입,성남 판교역,,"분 AWS, GCP등의 클라우드 기반에서 개발 경험 있으신 분 C++, Java, Kotlin, Go, Python, Javascript 등 하나 이상의 프로그래밍 언어에 능숙하신 분 논리적이고 체계적인 문제 해결 능력 및..."
e7b657db4a6471c3,Data Engineering 분야 전문가/개발자,서울 중구,,보유 경력 : 3년 이상- 학력/전공 : 학사 이상 / 전공 무관- Python 프로그래밍 역량 보유- Airflow와 같은 Workflow 도구를... 통신·모바일·게임>응용프로그래머> Python|인터넷·IT·통신·모바일·게임...
f54bac6c78fd3240,코딩에 빠진 수퍼 개발자 (펌웨어 개발),성남 수정구,,"학력무관직무기술: 펌웨어(Firmware), Embedded System S/W 개발(판교) c/c++, Python 3 명 근무조건 고용형태: 정규직근무부서: 개발팀급여조건: 연봉 협의 후 결정 전형단계 및 제출서류 전형단..."
e3bb1af4853122a1,Business Intelligence Strategist,서울 강남구,,"을 통하여 추출한 뒤 Data Studio에 시각화합니다.값을 얻는데 필요한 기술에 (i.e. Excel, Python, SQL, R 등) 제약은 존재하지 않고 필요에 따라 ML도 사용할 수 있으며, 이는 전적으로 파일 작성..."
6ac0f86a11f77561,new내비게이션 SW 검증 자동화 스크립트 개발(Python) 직무,서울 성동구,"연봉 24,000,000원 - 28,000,000원",직무내용] 현대오토에버사의 1차 협력업체채용분야 1. 내비게이션 SW 검증 자동화 스크립트 개발( Python) 직무 2. 차량용 내비게이션 SW 개발 및 유지보수 직무- 사업 분야 차량용 내비게이션 시스템 개발 및 유지보수...
89da943e9a11af36,각 부문별,서울 서초구,,세히보기 FLO 사업 관리 담당자 자세히보기 Data Engineer( Python Backend 경력자) 자세히보기 서비스 기획자(Senior) 자세... 게임>빅데이터·AI(인공지능)> Python|인터넷·IT·통신·모바일·게임...
f1751259fa682ac4,Data Scientist (토스신용데이터),서울 강남구,,통신·모바일·게임>빅데이터·AI(인공지능)> Python|인터넷·IT·통신·모바일·게임>응용프로그래머>머신러닝(ML)|인터넷·IT·통신·모바일·게임>응용프로그래머> Python|인터넷·IT·통신·모바일·게임>데이터베이스·DBA>SQL
9e154b5b00d09b31,Software Engineer - Python and K8s,서울,,"we are building a new community around Python opscode for open source applications... who enjoy Python, have a passion..."
42dc34d846250c97,new바른ICT연구소 프로그래머 인턴,서울 신촌역,,"악성댓글 데이터베이스 구축 및 크롤링 악성댓글 임베딩 악성댓글 분류 연구 4. 우대사항 Python, Matlab 기반 실험 경험 딥러닝 기반 실험 경험 5. 지원 서류 이력서(개발성과과제 등 포함..."
954f6da7c4562a6f,System Engineer,서울 강남구,,응용프로그래머>Linux|인터넷·IT·통신·모바일·게임>응용프로그래머>클라우드|인터넷·IT·통신·모바일·게임>응용프로그래머> Python|인터넷·IT·통신·모바일·게임>네트워크·서버·보안>UNIX·LINUX계열 서버운영·관리
d430486b959b2ddb,빅데이터 플랫폼 및 데이터 파이프라인 구축 인력 (2분야),서울 종로구,,통신·모바일·게임>ERP·시스템분석·설계>빅데이터|인터넷·IT·통신·모바일·게임>통신·모바일>플랫폼(VM)|인터넷·IT·통신·모바일·게임>응용프로그래머>JAVA|인터넷·IT·통신·모바일·게임>응용프로그래머> Python
13ef6f86810c0843,"2022년 상반기 주식회사 쏘마 전 개발 직군 (백엔드, 프론트엔드 외 신입/경력 정규직)",성남 분당구,,트엔드|인터넷·IT·통신·모바일·게임>웹프로그래머> Python|인터넷·IT·통신·모바일·게임>응용프로그래머>C·C++|인터넷·IT·통신·모바일·게임>응용프로그래머> Python|인터넷·IT·통신·모바일·게임>빅데이터·AI(인공...
5e24e8a474ef5f96,응용소프트웨어 개발자(PYTHON) (신입/경력),경기도 하남,"연봉 40,000,000원 - 50,000,000원",[직무내용] <응용소프트웨어 개발자( PYTHON) 채용-신입/경력>하기 기술 항목 중 5할 이상 유겸험자 우대 - Python / C++ / Node.js... 항목 중 5할 이상 유경험자 우대- Python/ C++/ Node.js...
287a2f9783758916,new한국행동과학연구소 각 부문 수시,서울 강남구,,"CSS3, 모바일 프로젝트 및 반응형 웹구축 경험, 교육이수자 백엔드개발자 - 개발 및 유지보수 - java, python, php, nodejs 사용자- oracle, mysql 등 유경험자 근무조건 경영·인사·총무·사무..."
51df90967b46e8f0,[외국계 스타트업 미소] Business Analyst,서울,,통신·모바일·게임>빅데이터·AI(인공지능)>데이터분석|인터넷·IT·통신·모바일·게임>빅데이터·AI(인공지능)> Python|인터넷·IT·통신·모바일·게임>데이터베이스·DBA>MySQL|인터넷·IT·통신·모바일·게임>데이터베이스...
f0295a73e3209a51,UX Researcher (정량/포트폴리오 없는 전형),서울 강남구,,방법으로 사용자의 패턴을 정량적으로 분석해요. 인터넷·IT·통신·모바일·게임>데이터베이스·DBA>SQL|인터넷·IT·통신·모바일·게임>응용프로그래머> Python|마케팅·광고·홍보·조사>조사·분석·통계>설문·리서치·모니터링
f6a0cd3f6af36d15,"백엔드, Python 외 경력 정규직",서울 강남구,,개발 경력 5년 이상 또는 Python 개발 경력 1년 이상- React... 게임>웹프로그래머>백엔드|인터넷·IT·통신·모바일·게임>웹프로그래머> Python|인터넷·IT·통신·모바일·게임>웹프로그래머>웹개발|인터넷·IT·통신...
aacec5dcf8689c28,newMetaverse 서비스 Graphics 개발자,서울 중구,,"필요 역량 및 직무 경험Unity 기반 상용 게임 / 모바일 앱을 실제 개발해본 경험프로그램 언어(C#, python 등)와 OpenGL, Vulkan 등 API를 이용한 개발 경험자격요건 인터넷·IT·통신·모바일·게임>응용..."
ef4f835e3c0b953e,newNetwork Engineer,서울 중구,,우대이런 경험이 있다면더욱 좋습니다.우대사항– (우대) 클라우드 및 네트워크 관련 자격증 보유자– (우대) Python/Shell script 가능자 인터넷·IT·통신·모바일·게임>네트워크·서버·보안>네트워크구축·운영·관리...
aac8e9355cb855ac,[인재풀] 아티스트 ART,서울,,3D Max등의 아트웍 툴 사용 경험 Max script 또는 Mel Script의 사용 경험 C# 또는 Python 언어에 대한 이해 및 활용 능력 아트웍 관련 툴 제작 또는 플러그인 제작 경험 Electronic...
135ebaa09a535c7e,[FashionGo korea] 추천 시스템 개발,성남 판교역,,"Linux, SQL/NoSQL 유경험자 - 컨테이너 기술 활용 경험 - C/C++, Java, golang, Python 등의 다양한 개발 언어 활용 경험 - Vespa-engine 경험 공통지원자격 - 병역필 혹은..."
75c348600e4ba140,국내 대기업 - 고객 데이터분석 포지션,서울,,"도출 경험자 - 데이터 분석 지식 및 분석 Tool((SQL, R, Python 등) 사용가능자 - 고객 Segmentation 및 타겟마케팅 실행... 게임>빅데이터·AI(인공지능)> Python|인터넷·IT·통신·모바일·게임..."
54caf3a3d845ffa3,[DI팀] 기계학습 Engineer (개인화 및 추천),서울 강남구,,용프로그래머> Python|인터넷·IT·통신·모바일·게임>응용프로그래머>JAVA|인터넷·IT·통신·모바일·게임>응용프로그래머>머신러닝(ML)|인터넷·IT·통신·모바일·게임>빅데이터·AI(인공지능)> Python|인터넷·IT·통신...
842f99fd48b546a0,추천 서비스 Applied Machine Learning Engineer,서울 중구,,"경험Docker, Kubernetes 기반 시스템 구축 경험 인터넷·IT·통신·모바일·게임>응용프로그래머> Python|인터넷·IT·통신·모바일·게임>빅데이터·AI(인공지능)>빅데이터|인터넷·IT·통신·모바일·게임>빅데이터..."
804087ce50438552,Data Analyst,서울,,"Big Data/ unstructured data. Strong SQL, experience with python for data analysis. Experience working with cloud data..."
dc7d4caf8bd4377f,new[일본계 대기업] FAE (Field Application Engineer) 모바일 viewing,서울 영등포구,,"일본어 가능자[우대사항]- Python, C/C++- Embedded... 서류합격자 개별 통보함.[키워드]이미지센서 / 전자회로 / PCB / Python C/C++ / Embedded system / 광학기술 전자·기계..."
e1e17acf489c69a6,"new[TmaxMetaverse/R&D] 게임 엔진, 게임 서버, 메타버스 스튜디오, Vision AI 엔진 개발...",성남 분당구,,"개발] - C++ 기반의 개발 경험자 - 멀티쓰레드, 네트워크 프로그래밍 지식 [Vision AI] - Python 기반의 개발 경험자 - Pytorch 및 Tensorflow 기반 Deep learning 모델 연구 경험..."
ad8621439e96b9a1,"newSoftware Engineer - Golang, Python, Android - Anbox Cloud",서울,,"Go and Python, and help customers... Solid programming experience in Go and Python System level programming (interaction..."
d08809180d5c7a39,스마트팩토리/MES 부문 경력,서울 강남구,,C#|인터넷·IT·통신·모바일·게임>응용프로그래머>JAVA|인터넷·IT·통신·모바일·게임>응용프로그래머> Python|인터넷·IT·통신·모바일·게임>통신·모바일>플랫폼(VM)|인터넷·IT·통신·모바일·게임>통신·모바일>서비스기...
582207ef91941686,Customer Experience Innovation Manager,서울 강남구,,으로 개선 가능한 고객의 Pain Point를 발굴해내요. 인터넷·IT·통신·모바일·게임>데이터베이스·DBA>SQL|마케팅·광고·홍보·조사>조사·분석·통계>통계·SAS|인터넷·IT·통신·모바일·게임>응용프로그래머> Python
298797630fdb1bd9,(주)미디어엠플러스 개발자 스크랩2 시바로지원,서울,,"및 운영 실시간 송출 관련 시스템 지원 자격조건 웹퍼블리셔 및 웹개발 HTML, CSS javascript Python 기본 문법 DB 모집기간 2022-04-21 ~ 2022-05-21 우대사항 react.js, redux..."
ca7a479e22ef60c7,Risk Manager (신용 RWA),서울 강남구,,해요. 금융·보험·증권>투자·분석·증권·외환>리스크매니저|인터넷·IT·통신·모바일·게임>데이터베이스·DBA>SQL|마케팅·광고·홍보·조사>조사·분석·통계>통계·SAS|인터넷·IT·통신·모바일·게임>응용프로그래머> Python
37f97415cb17357e,백엔드 개발자,서울 영등포구,,Back-end 설계 및 개발( Python 기반) 실무 경력 4년이상... 프로그래머> Python|인터넷·IT·통신·모바일·게임>응용프로그래머>API|인터넷·IT·통신·모바일·게임>응용프로그래머> Python|인터넷·IT·통신...
ba6a0ebb6ad9cd18,IT 인프라 운영 도구 개발,성남 판교역,,"모니터링 시스템 Web 개발 - 경력 4년 이상 - Linux 환경(LAMP) 경력 3년 이상 - Python, Django, Javascript, PHP 경험 - 다양한 Front-end 프레임 워크 사용 경험..."
b7b7dfbf2d9e59a5,서버 개발자,서울 강남구,"연봉 25,000,000원 - 35,000,000원","있으신 분- RDBMS, NoSQL에 대한 이해가 있으신 분우대사항- AWS 등 클라우드 환경 개발 경험- Python 또는 프로그래밍 언어 경험- 웹 개발 경험- Data 관리 경험- Typescript 사용 경험- Git..."
bb964ceb2f0fbab5,new[2022인턴] Programming - 게임 개발 (신규 IP 부문),성남 판교역,,"및 경험을 보유하신 분 - 멀티쓰레드 기본 지식/ Programming 스킬 및 경험을 보유하신 분 - Python, Javascript 등 스크립트 언어 경험을 보유하신 분 - 실제 외부에 게임을 오픈하고 관리해보신 분..."
28d09dd85cd521c5,new[SW 개발회사] 서버 & 네트워크 담당자,성남 분당구,,"업무에 필요한 자동화 시스템 스크립트 언어(Shell Script, Python 등)를 활용한 인프라 운영 경험이 있으신 분 - 정보보호 인증체계... 언어(Shell Script, Python 등)를 활용한 인프라 운영 경험..."
cadddc1d517bc19b,Renewable Energy Analyst,서울,,"other solar energy modeling tools; Experience utilizing Python, R or Matlab (or similar) for statistical analysis and data..."
c9b99315daa0a2d9,천재교과서 IT부문,서울 금천구,,웹개발|인터넷·IT·통신·모바일·게임>응용프로그래머>JAVA|인터넷·IT·통신·모바일·게임>응용프로그래머> Python|인터넷·IT·통신·모바일·게임>ERP·시스템분석·설계>시스템엔지니어|인터넷·IT·통신·모바일·게임>네트워크...
01a9ca0105819bc3,newSoftware Engineer for Machine Learning Operations,서울,,"more programming language suitable for machine learning (e.g., Python, R, C, C++) • 1+ year of experience using statistics..."
bec33b19427238a4,(주)작당모의 앱 개발자,서울 서초구,,"1. 백엔드 개발 1년이상, OOP/Function Language 개발 가능, AWS 개발 경험 등 2. Python Django 개발, Nodejs React 개발, MySQL 개발 경험 등 3. React Native..."
b82196274088fa63,Data Analyst (토스페이먼츠),서울 강남구,,투자·분석·증권·외환>리스크매니저|인터넷·IT·통신·모바일·게임>빅데이터·AI(인공지능)>데이터분석|인터넷·IT·통신·모바일·게임>ERP·시스템분석·설계>데이터분석|인터넷·IT·통신·모바일·게임>응용프로그래머> Python
d5e161ad6260fa89,new[2022인턴] Programming - 게임 개발 (Live IP 부문),성남 판교역,,"및 경험을 보유하신 분 - 멀티쓰레드 기본 지식/ Programming 스킬 및 경험을 보유하신 분 - Python, Javascript 등 스크립트 언어 경험을 보유하신 분 - 실제 외부에 게임을 오픈하고 관리해보신 분..."
69a55b188519aad6,new제어엔지니어(신입/전문연구요원),서울 강남구,,격요건]경력사항: 신입 또는 경력 2년 미만학력사항: 석사학위 소지자[우대사항]컨트롤러 설계 경험 C 또는 Python 프로그래밍 역량 운전 가능자 1 명 근무조건 고용형태: 정규직(수습기간3개월) / 석사학위 소지자 병역특...
b1dff208ada65163,연구 개발 프로그래머 (키메이커팀),서울 강남구,,"합니다.- C#, Python, Javascript 등 다양한 언어와 환경을 사용합니다. 지원자격 인터넷·IT·통신·모바일·게임>응용프로그래머>C#|인터넷·IT·통신·모바일·게임>응용프로그래머> Python|인터넷·IT·통신..."
8a62604d32bd9c42,"new인공지능 APP, WEB (Python/TensorFlow/J2EE)",부산 해운대구,"월급 2,000,000원","개발/ 인공지능 메타버스 솔루션 개발 Web 개발팀 2명담당업무ㆍJava Web/ APP 개발, Unity, Python 우대지원자격ㆍ경력 : 신입/경력 1년 이상우대사항ㆍ공학계열ㆍ인근거주자, 해당직무 근무경험근무조건ㆍ 근무..."
894af7a6dfdbaca6,[Beluga] 음성 (TTS/STT) 딥러닝 엔지니어 (경력 무관),서울 강남구,,제시 및 문제 해결을 위한 프로그래밍 능력을 보유하신 분 (C/C++/ Python/shell 등)오픈소스 기반 딥 러닝 프레임워크 활용 능력을 보유하... 그래머>C·C++|인터넷·IT·통신·모바일·게임>응용프로그래머> Python
