ID,Title,Location,Salary,Summary
e742db63ad7e269f,프론트엔드 개발자/디자이너/기획/마케터 정직원,성남 수정구,"연봉 30,000,000원 - 35,000,000원",JAVA|인터넷·IT·통신·모바일·게임>웹프로그래머>백엔드|인터넷·IT·통신·모바일·게임>웹프로그래머> Python|인터넷·IT·통신·모바일·게임>웹프로그래머>HDML|인터넷·IT·통신·모바일·게임>웹프로그래머>APM|인터넷...
eab9162310d691f8,추천/ML SaaS 플랫폼 개발을 위한 MLOps 엔지니어,성남 판교역,,"학위(석사/박사)를 소지하신 분 운영체제, 네트워크, 데이터베이스에 대한 기본적인 이해가 있으신 분 Python에 능숙하신 분 어떤 경험이 있으면 좋나요? 대용량 실시간 서비스 개발 운영 경험이 있으신 분 Cloud..."
5ab0b45dfa93411b,Data Engineer 신입사원,서울 강남구,,"분류, 개인정보 비식별화, 불량 코퍼스 필터링 등 다양한 ML 프로젝트 (예정)[자격요건]- Julia / Python / R 중에서 자신 있는 프로그래밍 언어가 있는 분- 하나의 데이터도 놓치지 않고 꼼꼼하게 관리할 수..."
b218093a44af3aea,삼성 청년 SW 아카데미 8기,서울 강남구,,로그래머>머신러닝(ML)|인터넷·IT·통신·모바일·게임>응용프로그래머> Python|인터넷·IT·통신·모바일·게임>웹프로그래머>웹개발|인터넷·IT·통신... 통신·모바일·게임>웹프로그래머> Python|인터넷·IT·통신·모바일·게임...
ac9068957c550cb3,데이터 전문가(모델러/분석가/엔지니어) 모집,성남 판교역,,대용량 데이터를 효율적으로 사용하기 위한 기반 데이터 가공 지원자격 데이터 사이언스를 위한 언어(R/ Python/Scala) 및 도구(scikit-learn/Spark MLlib/Tensorflow/Pytorch 등)를...
e36b281df2933890,[위메프서비스] E-Commerce 데이터엔지니어/NLP개발자,대한민국,,"우리가 사용하는 기술] 개발언어: Python, Java 하둡인프라... 시스템 Hadoop 및 Spark 경험이 있으신 분 Java, Python 개발 능력을 보유하신 분(중급 이상) Hadoop Ecosystem..."
3b7dbdf85a326a6d,국내 대기업 - AI 및 딥러닝 관련 경력자,서울,,"관련 전문 지식 있는 분 - Python 또는 Scala, JAVA 활용... 레임워크 활용 역량 좋은 분- 자연어처리 관련 전문 지식 있는 분- Python 또는 Scala, JAVA 활용 역량- 미디어/커머스/전자/IT 업계..."
681608bebd3b74e8,GUI 시스템 개발,서울 송파구,,로그래머>백엔드|인터넷·IT·통신·모바일·게임>웹프로그래머>프론트엔드|인터넷·IT·통신·모바일·게임>웹프로그래머> Python|인터넷·IT·통신·모바일·게임>웹프로그래머>ASP.NET|인터넷·IT·통신·모바일·게임>웹프로그래머...
926503c8793584ef,new인공지능(AI) 모델링 분야 정규직 부문 신입,서울 성동구,,"문인공지능 모델링 모집직무인공지능(AI)·빅데이터, 인공지능(AI), Python, 빅데이터 모집학력대학교(4년)고용형태정규직 인터넷·IT·통신·모바... 터분석|인터넷·IT·통신·모바일·게임>빅데이터·AI(인공지능)> Python"
35edadb6d2243223,[AI 가상인간 기술 스타트업] (주)유어라운드 AI 연구개발자,서울 마포구,,"이동, 전송 등의 작업)- 딥러닝 모델에 대한 기본적인 지식 보유자- Python으로 코드작성이 가능하신 분- 이미지 데이터 처리 경험이 있으신 분... 게임>빅데이터·AI(인공지능)> Python|인터넷·IT·통신·모바일·게임..."
5068ea0cd85ca352,new2022년 RIST 위촉직 연구원 수시,포항 남구,,기계·기술·화학·연구개발>광학·의료장비>의료장비|인터넷·IT·통신·모바일·게임>빅데이터·AI(인공지능)>데이터분석|인터넷·IT·통신·모바일·게임>응용프로그래머> Python|인터넷·IT·통신·모바일·게임>응용프로그래머>JAVA
4c25d6649f8434a8,[외국계 스타트업 미소] Business Analyst Intern (정규직 전환형),서울,,통신·모바일·게임>빅데이터·AI(인공지능)>데이터분석|인터넷·IT·통신·모바일·게임>빅데이터·AI(인공지능)> Python|인터넷·IT·통신·모바일·게임>데이터베이스·DBA>MySQL|인터넷·IT·통신·모바일·게임>데이터베이스...
caaf48261cc4c515,new웹 크롤러 전문가,서울 중구,,"HBase, Spark 등 데이터 처리 경험Elasticsearch, RDBMS(MySQL) 운영 경험 Python, Java, Scala 등 개발 숙련자Linux 시스템 개발 및 운영 경험 인터넷·IT·통신·모바일·게임>빅데..."
e91b5984e7f5d3fd,"데이터베이스개발자, 웹개발 신입/경력 정규직",서울 영등포구,"연봉 36,000,000원 - 60,000,000원","개발자 ㆍCss/html 등 웹디자인 관련 유경험자 ㆍ자바스크립트, Python, C++, 닷넷 등 ㆍNode, Selenium, electron... 관련 유경험자ㆍ자바스크립트, Python, C++, 닷넷 등 ㆍNode..."
3401d79fd1673757,머신러닝 Integration 담당자 영입,서울 중구,,게임>빅데이터·AI(인공지능)> Python|인터넷·IT·통신·모바일·게임... 응용프로그래머>JAVA|인터넷·IT·통신·모바일·게임>응용프로그래머> Python|인터넷·IT·통신·모바일·게임>ERP·시스템분석·설계>인공지능(AI) 분석
5b0e88a7d6d4afce,[메디픽셀] 딥러닝 & SW 개발 엔지니어,서울 마포구,,"learning framework에 대한 이해가 있으신 분ㆍ C++, python 개발 경험이 있으신 분[우대사항]ㆍ관련 학과 석사 이상 학위(컴퓨터... 통신·모바일·게임>응용프로그래머> Python|인터넷·IT·통신·모바일·게임..."
56336e1593f93f5c,new협업도구 및 코드관리도구 운영담당자 영입,성남 분당구,,통신·모바일·게임>응용프로그래머>Linux|인터넷·IT·통신·모바일·게임>응용프로그래머> Python|인터넷·IT·통신·모바일·게임>웹프로그래머> Python|인터넷·IT·통신·모바일·게임>빅데이터·AI(인공지능)> Python
77d2adf110c6347c,new[네이버계열사][NIT Service] 네이버 클라우드 플랫폼 기술지원,성남 분당구,,"AWS, Azure, KT Cloud 등)- Shell Script, Python 활용 가능 0 명 근무조건 고용형태: 정규직(수습기간3개월)급여조건... Windows|인터넷·IT·통신·모바일·게임>응용프로그래머> Python"
ccd4a97adf6050b4,newAnalytical Consultant,서울,,"experience in project delivery Experienced using SAS, R or Python Ability to communicate with people with various technical..."
da0a91b3a7b28b53,[Business Assessment Office] Jr. IT Internal Auditor (3년 이상),서울 강남구,,"저희가 찾는 그 분입니다! CFE, CISA, CISSP 자격증 보유 Python, Powershell 등의 스크립팅 언어 사용/개발 능력이 있으신 분... 지원>IT기술지원|인터넷·IT·통신·모바일·게임>응용프로그래머> Python"
de3ba485f112579b,new컴파일러 엔지니어,성남 분당구,"연봉 50,000,000원 - 150,000,000원",인터넷·IT·통신·모바일·게임>응용프로그래머> Python|인터넷·IT·통신·모바일·게임>응용프로그래머>인공지능(AI)|인터넷·IT·통신·모바일·게임>빅데이터·AI(인공지능)> Python|인터넷·IT·통신·모바일·게임>빅데이터...
8ad4e730a734cd06,new토링(주) 웹개발자(프론트/백엔드/풀스택),서울 강남구,,"ASP, HTML, 백엔드, 프론트엔드, 응용프로그램개발, IOS앱개발, Android앱개발, API, Python, Java, 데이터베이스·DBA, MS-SQL, MySQL, 데이타마이닝, Oracle 모집학력 학력무관..."
53fbfe54f327d9dc,AI Software Engineer,경기도 성남,,"TensorFlow 5+ years of programming experience in Python, C/C++ and MATLAB Experience working with other developers using Git..."
